{
  "source_id": "S-0000",
  "extracted_on": "2026-01-01",
  "extracted_by": "PREENCHER",
  "access_level": "full_text",
  "text_source": "PREENCHER",
  "pagination_reliable": true,
  "fields": {
    "reference": "NR — não reportado",
    "research_question": "NR — não reportado",
    "country_jurisdiction": "NR — não reportado",
    "population": "NR — não reportado",
    "unit_of_analysis": "NR — não reportado",
    "period": "NR — não reportado",
    "data_source": "NR — não reportado",
    "sample_size": "NR — não reportado",
    "intervention": "NR — não reportado",
    "comparison": "NR — não reportado",
    "outcome": "NR — não reportado",
    "method": "NR — não reportado",
    "empirical_strategy": "NR — não reportado",
    "causal_identification": "NR — não reportado",
    "model_equation": "NR — não reportado",
    "variables": "NR — não reportado",
    "main_result": "NR — não reportado",
    "robustness": "NR — não reportado",
    "limitations": "NR — não reportado",
    "doi": "NR — não reportado",
    "url": "NR — não reportado"
  },
  "field_locations": {},
  "estimates": [],
  "notes": "Modelo vazio: todos os campos começam como NR e só mudam com informação localizada no documento."
}
