{
  "source_id": "S-0005",
  "extracted_on": "2026-09-24",
  "extracted_by": "claude (exemplo)",
  "access_level": "metadata_only",
  "text_source": "Scite search_literature (metadados) e read_fulltext (sem texto)",
  "pagination_reliable": false,
  "fields": {
    "reference": "von Loessl, V., & Wetzel, H. (2022). Revenue decoupling, energy demand, and energy efficiency: Empirical evidence from the U.S. electricity sector. Utilities Policy, 79, 101416.",
    "research_question": "NR — não reportado",
    "country_jurisdiction": "NR — não reportado",
    "population": "NR — não reportado",
    "unit_of_analysis": "NR — não reportado",
    "period": "NR — não reportado",
    "data_source": "NR — não reportado",
    "sample_size": "NR — não reportado",
    "intervention": "NR — não reportado",
    "comparison": "NR — não reportado",
    "outcome": "NR — não reportado",
    "method": "NR — não reportado",
    "empirical_strategy": "NR — não reportado",
    "causal_identification": "NR — não reportado",
    "model_equation": "NR — não reportado",
    "variables": "NR — não reportado",
    "main_result": "NR — não reportado",
    "robustness": "NR — não reportado",
    "limitations": "NR — não reportado",
    "doi": "10.1016/j.jup.2022.101416",
    "url": "https://doi.org/10.1016/j.jup.2022.101416"
  },
  "field_locations": {},
  "estimates": [],
  "notes": "Somente metadados. Nenhum campo de conteúdo pode ser extraído: Não foi possível verificar esta informação nas fontes consultadas."
}
