{
  "source_id": "S-0004",
  "extracted_on": "2026-09-24",
  "extracted_by": "claude (exemplo)",
  "access_level": "metadata_only",
  "text_source": "Scite search_literature (metadados) e read_fulltext (sem texto)",
  "pagination_reliable": false,
  "fields": {
    "reference": "Datta, S. (2019). Decoupling and demand-side management: Evidence from the US electric industry. Energy Policy, 132, 175–184.",
    "research_question": "NR — não reportado",
    "country_jurisdiction": "NR — não reportado",
    "population": "NR — não reportado",
    "unit_of_analysis": "NR — não reportado",
    "period": "NR — não reportado",
    "data_source": "NR — não reportado",
    "sample_size": "NR — não reportado",
    "intervention": "NR — não reportado",
    "comparison": "NR — não reportado",
    "outcome": "NR — não reportado",
    "method": "NR — não reportado",
    "empirical_strategy": "NR — não reportado",
    "causal_identification": "NR — não reportado",
    "model_equation": "NR — não reportado",
    "variables": "NR — não reportado",
    "main_result": "NR — não reportado",
    "robustness": "NR — não reportado",
    "limitations": "NR — não reportado",
    "doi": "10.1016/j.enpol.2019.05.005",
    "url": "https://doi.org/10.1016/j.enpol.2019.05.005"
  },
  "field_locations": {},
  "estimates": [],
  "notes": "Somente metadados. Nenhum campo de conteúdo pode ser extraído: Não foi possível verificar esta informação nas fontes consultadas."
}
